{
  "$schema": "https://json-schema.org/draft/2020-12/schema",
  "type": "object",
  "additionalProperties": false,
  "required": [
    "id",
    "code_id",
    "family_id",
    "title",
    "instance_kind",
    "matrix_format",
    "artifacts",
    "parameters",
    "derived_properties",
    "provenance"
  ],
  "properties": {
    "id": {
      "type": "string",
      "pattern": "^[a-z0-9]+(?:-[a-z0-9]+)*$"
    },
    "code_id": {
      "type": "string",
      "minLength": 1
    },
    "family_id": {
      "type": "string",
      "minLength": 1
    },
    "title": {
      "type": "string",
      "minLength": 1
    },
    "instance_kind": {
      "const": "finite_css_instance"
    },
    "matrix_format": {
      "const": "dense_binary_json"
    },
    "artifacts": {
      "type": "object",
      "additionalProperties": false,
      "required": [
        "hx",
        "hz"
      ],
      "properties": {
        "hx": {
          "const": "hx.json"
        },
        "hz": {
          "const": "hz.json"
        },
        "observables_x": {
          "const": "observables_x.json"
        }
      }
    },
    "parameters": {
      "type": "object",
      "minProperties": 1,
      "additionalProperties": {
        "type": [
          "string",
          "integer",
          "number",
          "boolean",
          "null",
          "array",
          "object"
        ]
      }
    },
    "derived_properties": {
      "type": "object",
      "additionalProperties": false,
      "required": [
        "n",
        "distance",
        "kx",
        "kz",
        "mx",
        "mz"
      ],
      "properties": {
        "n": {
          "type": "integer",
          "minimum": 1
        },
        "distance": {
          "type": [
            "integer",
            "null"
          ],
          "minimum": 1
        },
        "kx": {
          "type": [
            "integer",
            "null"
          ],
          "minimum": 0
        },
        "kz": {
          "type": [
            "integer",
            "null"
          ],
          "minimum": 0
        },
        "mx": {
          "type": "integer",
          "minimum": 0
        },
        "mz": {
          "type": "integer",
          "minimum": 0
        }
      }
    },
    "provenance": {
      "type": "object",
      "additionalProperties": false,
      "required": [
        "generator",
        "generator_env",
        "generated_at",
        "generator_script",
        "generator_parameters"
      ],
      "properties": {
        "generator": {
          "enum": [
            "tensorQEC.jl",
            "autoqec-bivariate-bicycle-fallback"
          ]
        },
        "generator_env": {
          "type": "string",
          "minLength": 1
        },
        "generated_at": {
          "type": "string",
          "pattern": "^\\d{4}-\\d{2}-\\d{2}T\\d{2}:\\d{2}:\\d{2}Z$"
        },
        "generator_script": {
          "type": "string",
          "minLength": 1
        },
        "generator_parameters": {
          "type": "object",
          "minProperties": 1,
          "additionalProperties": {
            "type": [
              "string",
              "integer",
              "number",
              "boolean",
              "null",
              "array",
              "object"
            ]
          }
        },
        "exact_distance": {
          "type": "object",
          "additionalProperties": false,
          "required": [
            "bound_type",
            "distance",
            "method",
            "rstim_issue",
            "verified_command"
          ],
          "properties": {
            "bound_type": {
              "const": "exact"
            },
            "distance": {
              "type": "integer",
              "minimum": 1
            },
            "method": {
              "type": "string",
              "minLength": 1
            },
            "rstim_issue": {
              "type": "string",
              "minLength": 1
            },
            "verified_command": {
              "type": "string",
              "minLength": 1
            }
          }
        },
        "paper_evidence": {
          "type": "array",
          "minItems": 1,
          "items": {
            "type": "string",
            "minLength": 1
          }
        },
        "promoted_by": {
          "const": "autoqec-search promote"
        },
        "source_run": {
          "type": "string",
          "minLength": 1
        },
        "source_candidate_id": {
          "type": "string",
          "minLength": 1
        },
        "source_manifest_path": {
          "type": "string",
          "minLength": 1
        },
        "promote_rules": {
          "type": "object"
        }
      },
      "allOf": [
        {
          "if": {
            "properties": {
              "generator": { "const": "autoqec-bivariate-bicycle-fallback" }
            },
            "required": ["generator"]
          },
          "then": {
            "properties": {
              "generator_env": { "const": "python3" },
              "generator_script": {
                "const": "scripts/generate_bivariate_bicycle_instance.py"
              }
            }
          }
        }
      ]
    }
  }
}
