{
  "artifacts": {
    "hx": "hx.json",
    "hz": "hz.json"
  },
  "code_id": "rotated-surface-code",
  "derived_properties": {
    "distance": 3,
    "kx": null,
    "kz": null,
    "mx": 4,
    "mz": 4,
    "n": 9
  },
  "family_id": "surface-code",
  "id": "rotated-surface-d3-example",
  "instance_kind": "finite_css_instance",
  "matrix_format": "dense_binary_json",
  "parameters": {
    "distance": 3,
    "layout": "rotated"
  },
  "provenance": {
    "generated_at": "2026-05-28T00:00:00Z",
    "generator": "tensorQEC.jl",
    "generator_env": "julia/tensorqec_env",
    "generator_parameters": {
      "distance": 3,
      "layout": "rotated"
    },
    "generator_script": "julia/tensorqec_env/scripts/generate_instance.jl",
    "promote_rules": {
      "max_ler_at_p": {
        "ler": 0.5,
        "p": 0.005
      },
      "min_distance": 3,
      "require_distance_verified": true
    },
    "promoted_by": "autoqec-search promote",
    "source_candidate_id": "rotated-surface-d3-example",
    "source_manifest_path": "candidates/rotated-surface-d3-example/evaluations/rotated-memory-x-cdep-v1/rmatching-default-v1/manifest.json",
    "source_run": "rotated-surface-baseline/m1-demo"
  },
  "title": "Rotated Surface Code d=3"
}
