{
  "id": "rotated-surface-code-d3",
  "code_id": "rotated-surface-code",
  "family_id": "surface-code",
  "title": "Rotated Surface Code d=3",
  "instance_kind": "finite_css_instance",
  "matrix_format": "dense_binary_json",
  "artifacts": {
    "hx": "hx.json",
    "hz": "hz.json"
  },
  "parameters": {
    "distance": 3,
    "layout": "rotated"
  },
  "derived_properties": {
    "n": 9,
    "distance": 3,
    "kx": null,
    "kz": null,
    "mx": 4,
    "mz": 4
  },
  "provenance": {
    "generator": "tensorQEC.jl",
    "generator_env": "julia/tensorqec_env",
    "generated_at": "2026-05-28T00:00:00Z",
    "generator_script": "julia/tensorqec_env/scripts/generate_instance.jl",
    "generator_parameters": {
      "distance": 3,
      "layout": "rotated"
    }
  }
}
