{
  "artifacts": {
    "hx": "hx.json",
    "hz": "hz.json"
  },
  "code_id": "rotated-surface-code",
  "derived_properties": {
    "distance": 7,
    "kx": null,
    "kz": null,
    "mx": 24,
    "mz": 24,
    "n": 49
  },
  "family_id": "surface-code",
  "id": "rotated-surface-code-d7",
  "instance_kind": "finite_css_instance",
  "matrix_format": "dense_binary_json",
  "parameters": {
    "distance": 7,
    "layout": "rotated"
  },
  "provenance": {
    "generated_at": "2026-06-15T00:00:00Z",
    "generator": "tensorQEC.jl",
    "generator_env": "julia/tensorqec_env",
    "generator_parameters": {
      "distance": 7,
      "layout": "rotated"
    },
    "generator_script": "julia/tensorqec_env/scripts/generate_instance.jl"
  },
  "title": "Rotated Surface Code d=7"
}
