{
  "artifacts": {
    "hx": "hx.json",
    "hz": "hz.json"
  },
  "code_id": "bivariate-bicycle-code",
  "derived_properties": {
    "distance": null,
    "kx": null,
    "kz": null,
    "mx": 36,
    "mz": 36,
    "n": 72
  },
  "family_id": "bivariate-bicycle-code",
  "id": "bivariate-bicycle-code-m6-n6",
  "instance_kind": "finite_css_instance",
  "matrix_format": "dense_binary_json",
  "parameters": {
    "hd": [
      [
        1,
        1
      ],
      [
        0,
        2
      ]
    ],
    "m": 6,
    "n": 6,
    "vc": [
      [
        1,
        0
      ],
      [
        0,
        1
      ]
    ]
  },
  "provenance": {
    "generated_at": "2026-06-16T00:00:00Z",
    "generator": "autoqec-bivariate-bicycle-fallback",
    "generator_env": "python3",
    "generator_parameters": {
      "hd": [
        [
          1,
          1
        ],
        [
          0,
          2
        ]
      ],
      "m": 6,
      "n": 6,
      "vc": [
        [
          1,
          0
        ],
        [
          0,
          1
        ]
      ]
    },
    "generator_script": "scripts/generate_bivariate_bicycle_instance.py"
  },
  "title": "Bivariate Bicycle Code m=6 n=6"
}
